<?xml version="1.0" encoding="UTF-8"?>
<instance name="Kamaloka-39" xmlns="http://www.l2jfree.com"
  xmlns:xsi="http://www.w3.org/2001/XMLSchema-instance"
  xsi:schemaLocation="http://www.l2jfree.com ../templates/instances.xsd">
  <activityTime val="45"/>
  <timeDelay val="24"/>
  <allowSummon val="false"/>
  <emptyDestroyTime val="300"/>
  <returnTeleport x="18149" y="146024" z="-3100"/>
  <spawnList>
	<spawn npcId="32496" x="-10857" y="-174902" z="-10946" heading="3355"/> 
  </spawnList>
</instance>
