<?xml version="1.0" encoding="UTF-8"?>
<instance template="9" name="Dark Cloud Mansion" xmlns="http://www.l2jfree.com"
  xmlns:xsi="http://www.w3.org/2001/XMLSchema-instance"
  xsi:schemaLocation="http://www.l2jfree.com ../templates/instances.xsd">
  <activityTime val="30"/>
  <timeDelay val="24"/>
  <allowSummon val="false"/>
  <emptyDestroyTime val="60"/>
  <returnTeleport x="139408" y="150805" z="-3108"/>
  <doorList>
    <door doorId="24230001"/>
    <door doorId="24230002"/>
    <door doorId="24230005"/>
    <door doorId="24230003"/>
    <door doorId="24230004"/>
    <door doorId="24230006"/>
    <door doorId="24230007"/>
    <door doorId="24230008"/>
    <door doorId="24230009"/>
    <door doorId="24230010"/>
    <door doorId="24230011"/>
    <door doorId="24230012"/>
    <door doorId="24230013"/>
  </doorList>
</instance>
