<?xml version="1.0" encoding="UTF-8"?>
<!-- author hex1r0 -->
<instance name="TowerOfNaiaRoom" xmlns="http://www.l2jfree.com"
  xmlns:xsi="http://www.w3.org/2001/XMLSchema-instance"
  xsi:schemaLocation="http://www.l2jfree.com ../templates/instances.xsd">
  <emptyDestroyTime val="10"/>
  <allowSummon val="false"/>
  <returnTeleport x="16430" y="244437" z="11618"/>
  <doorList>
    <door doorId="18250001"/>
    <door doorId="18250002"/>
    <door doorId="18250003"/>
    <door doorId="18250004"/>
    <door doorId="18250005"/>
    <door doorId="18250006"/>
    <door doorId="18250007"/>
    <door doorId="18250008"/>
    <door doorId="18250009"/>
    <door doorId="18250010"/>
    <door doorId="18250011"/>
    <door doorId="18250101"/>
    <door doorId="18250013"/>
    <door doorId="18250014"/>
    <door doorId="18250015"/>
    <door doorId="18250102"/>
    <door doorId="18250017"/>
    <door doorId="18250018"/>
    <door doorId="18250019"/>
    <door doorId="18250103"/>
    <door doorId="18250021"/>
    <door doorId="18250022"/>
    <door doorId="18250023"/>
    <door doorId="18250024"/>
    <door doorId="18250025"/>
  </doorList>
</instance>